{"asset_features":[{"asset_id":"asset:fixture-school-zone-01","asset_kind":"critical_facility_zone","asset_name":"Fixture School Protection Zone","geometry_type":"polygon","priority_class":"critical","ring":[{"lat":38.7015,"lon":-120.799},{"lat":38.703,"lon":-120.799},{"lat":38.703,"lon":-120.7964},{"lat":38.7015,"lon":-120.7964},{"lat":38.7015,"lon":-120.799}],"schema_version":"1.0.0","tags":{"category":"asset_zone"}},{"asset_id":"asset:fixture-water-tank-01","asset_kind":"water_supply","asset_name":"Fixture Water Tank","geometry_type":"point","point":{"lat":38.7008,"lon":-120.7949},"priority_class":"high","schema_version":"1.0.0","tags":{"category":"poi"}}],"bounds":{"max_lat":38.705,"max_lon":-120.7885,"min_lat":38.6975,"min_lon":-120.8025},"bundle_fingerprint":"a0e45b432b496628d3752d1e29ba7beb95e7d6e024397ad25a3e2743e81903cb","compilation":{"compiled_at_utc":"2026-04-19T12:00:00Z","compiler_version":"orbital-shepherd-region-builder/1.0.0","source_manifest_id":"rm:fixture-micro-region:v1","source_manifest_schema_version":"1.0.0","source_manifest_sha256":"a7b912eed9e1c531f13b203b16d74eec98270ac4d0a3f737db9cb26bb3aa832e"},"facilities":[{"availability":"nominal","capacity_units":3,"facility_id":"fac:fixture-staging-01","facility_name":"Fixture Staging Area 01","facility_type":"staging_area","location":{"alt_m":636.0,"lat":38.7034,"lon":-120.7958},"schema_version":"1.0.0","supported_unit_types":["engine","crew","dozer","command"]},{"availability":"nominal","capacity_units":2,"facility_id":"fac:fixture-station-01","facility_name":"Fixture Station 01","facility_type":"station","location":{"alt_m":610.0,"lat":38.7021,"lon":-120.8013},"schema_version":"1.0.0","supported_unit_types":["engine","crew","command"]}],"h3_cover":{"cell_count":3,"cell_ids":["8928308280fffff","8928341aec3ffff","8928d54250bffff"],"generation_strategy":"explicit","resolution":9},"provenance_notes":["Fixture region uses a checked-in road extract so tests do not rely on internet access.","Road network contains OpenStreetMap-derived content. Attribution: OpenStreetMap contributors."],"region_bundle_id":"rb:fixture-micro-region:v1","region_id":"region:fixture-micro-region","region_manifest_id":"rm:fixture-micro-region:v1","region_name":"Fixture Micro Region","road_edges":[{"distance_m":321.085,"edge_id":"re:si-fixture-micro-region-roads-v1:1001:seg-0:forward","geometry":[{"lat":38.7002,"lon":-120.8005},{"lat":38.7002,"lon":-120.7968}],"oneway":false,"road_class":"residential","road_name":"Pine Ridge Road","source_edge_ref":"1001","source_ingest_id":"si:fixture-micro-region-roads:v1","source_node_id":"rn:38.700200:120.800500","speed_kph":30.0,"target_node_id":"rn:38.700200:120.796800","travel_time_seconds":42.53},{"distance_m":321.085,"edge_id":"re:si-fixture-micro-region-roads-v1:1001:seg-0:reverse","geometry":[{"lat":38.7002,"lon":-120.7968},{"lat":38.7002,"lon":-120.8005}],"oneway":false,"road_class":"residential","road_name":"Pine Ridge Road","source_edge_ref":"1001","source_ingest_id":"si:fixture-micro-region-roads:v1","source_node_id":"rn:38.700200:120.796800","speed_kph":30.0,"target_node_id":"rn:38.700200:120.800500","travel_time_seconds":42.53},{"distance_m":333.178,"edge_id":"re:si-fixture-micro-region-roads-v1:1001:seg-1:forward","geometry":[{"lat":38.7002,"lon":-120.7968},{"lat":38.701,"lon":-120.7931}],"oneway":false,"road_class":"residential","road_name":"Pine Ridge Road","source_edge_ref":"1001","source_ingest_id":"si:fixture-micro-region-roads:v1","source_node_id":"rn:38.700200:120.796800","speed_kph":30.0,"target_node_id":"rn:38.701000:120.793100","travel_time_seconds":43.981},{"distance_m":333.178,"edge_id":"re:si-fixture-micro-region-roads-v1:1001:seg-1:reverse","geometry":[{"lat":38.701,"lon":-120.7931},{"lat":38.7002,"lon":-120.7968}],"oneway":false,"road_class":"residential","road_name":"Pine Ridge Road","source_edge_ref":"1001","source_ingest_id":"si:fixture-micro-region-roads:v1","source_node_id":"rn:38.701000:120.793100","speed_kph":30.0,"target_node_id":"rn:38.700200:120.796800","travel_time_seconds":43.981},{"distance_m":189.031,"edge_id":"re:si-fixture-micro-region-roads-v1:1002:seg-0:forward","geometry":[{"lat":38.6985,"lon":-120.7968},{"lat":38.7002,"lon":-120.7968}],"oneway":true,"road_class":"secondary","road_name":"Lookout Spur","source_edge_ref":"1002","source_ingest_id":"si:fixture-micro-region-roads:v1","source_node_id":"rn:38.698500:120.796800","speed_kph":45.0,"target_node_id":"rn:38.700200:120.796800","travel_time_seconds":19.123},{"distance_m":366.253,"edge_id":"re:si-fixture-micro-region-roads-v1:1002:seg-1:forward","geometry":[{"lat":38.7002,"lon":-120.7968},{"lat":38.7034,"lon":-120.7958}],"oneway":true,"road_class":"secondary","road_name":"Lookout Spur","source_edge_ref":"1002","source_ingest_id":"si:fixture-micro-region-roads:v1","source_node_id":"rn:38.700200:120.796800","speed_kph":45.0,"target_node_id":"rn:38.703400:120.795800","travel_time_seconds":33.3},{"distance_m":259.348,"edge_id":"re:si-fixture-micro-region-roads-v1:1003:seg-0:forward","geometry":[{"lat":38.701,"lon":-120.7931},{"lat":38.702,"lon":-120.7904}],"oneway":false,"road_class":"tertiary","road_name":"Cedar Loop","source_edge_ref":"1003","source_ingest_id":"si:fixture-micro-region-roads:v1","source_node_id":"rn:38.701000:120.793100","speed_kph":35.0,"target_node_id":"rn:38.702000:120.790400","travel_time_seconds":30.676},{"distance_m":259.348,"edge_id":"re:si-fixture-micro-region-roads-v1:1003:seg-0:reverse","geometry":[{"lat":38.702,"lon":-120.7904},{"lat":38.701,"lon":-120.7931}],"oneway":false,"road_class":"tertiary","road_name":"Cedar Loop","source_edge_ref":"1003","source_ingest_id":"si:fixture-micro-region-roads:v1","source_node_id":"rn:38.702000:120.790400","speed_kph":35.0,"target_node_id":"rn:38.701000:120.793100","travel_time_seconds":30.676},{"distance_m":269.387,"edge_id":"re:si-fixture-micro-region-roads-v1:1003:seg-1:forward","geometry":[{"lat":38.702,"lon":-120.7904},{"lat":38.7042,"lon":-120.7891}],"oneway":false,"road_class":"tertiary","road_name":"Cedar Loop","source_edge_ref":"1003","source_ingest_id":"si:fixture-micro-region-roads:v1","source_node_id":"rn:38.702000:120.790400","speed_kph":35.0,"target_node_id":"rn:38.704200:120.789100","travel_time_seconds":31.708},{"distance_m":269.387,"edge_id":"re:si-fixture-micro-region-roads-v1:1003:seg-1:reverse","geometry":[{"lat":38.7042,"lon":-120.7891},{"lat":38.702,"lon":-120.7904}],"oneway":false,"road_class":"tertiary","road_name":"Cedar Loop","source_edge_ref":"1003","source_ingest_id":"si:fixture-micro-region-roads:v1","source_node_id":"rn:38.704200:120.789100","speed_kph":35.0,"target_node_id":"rn:38.702000:120.790400","travel_time_seconds":31.708},{"distance_m":222.384,"edge_id":"re:si-fixture-micro-region-roads-v1:1004:seg-0:forward","geometry":[{"lat":38.7002,"lon":-120.8005},{"lat":38.7021,"lon":-120.8013}],"oneway":false,"road_class":"service","road_name":"Station Access","source_edge_ref":"1004","source_ingest_id":"si:fixture-micro-region-roads:v1","source_node_id":"rn:38.700200:120.800500","speed_kph":20.0,"target_node_id":"rn:38.702100:120.801300","travel_time_seconds":44.029},{"distance_m":222.384,"edge_id":"re:si-fixture-micro-region-roads-v1:1004:seg-0:reverse","geometry":[{"lat":38.7021,"lon":-120.8013},{"lat":38.7002,"lon":-120.8005}],"oneway":false,"road_class":"service","road_name":"Station Access","source_edge_ref":"1004","source_ingest_id":"si:fixture-micro-region-roads:v1","source_node_id":"rn:38.702100:120.801300","speed_kph":20.0,"target_node_id":"rn:38.700200:120.800500","travel_time_seconds":44.029}],"road_nodes":[{"location":{"lat":38.6985,"lon":-120.7968},"node_id":"rn:38.698500:120.796800"},{"location":{"lat":38.7002,"lon":-120.7968},"node_id":"rn:38.700200:120.796800"},{"location":{"lat":38.7002,"lon":-120.8005},"node_id":"rn:38.700200:120.800500"},{"location":{"lat":38.701,"lon":-120.7931},"node_id":"rn:38.701000:120.793100"},{"location":{"lat":38.702,"lon":-120.7904},"node_id":"rn:38.702000:120.790400"},{"location":{"lat":38.7021,"lon":-120.8013},"node_id":"rn:38.702100:120.801300"},{"location":{"lat":38.7034,"lon":-120.7958},"node_id":"rn:38.703400:120.795800"},{"location":{"lat":38.7042,"lon":-120.7891},"node_id":"rn:38.704200:120.789100"}],"schema_version":"1.0.0","spatial_ingests":[{"coverage_bounds":{"max_lat":38.705,"max_lon":-120.7885,"min_lat":38.6975,"min_lon":-120.8025},"feature_count":4,"ingest_time_utc":"2026-04-19T12:00:00Z","layer_type":"roads","notes":"Deterministic directed road graph normalized into canonical segment IDs and travel-time defaults. Small deterministic tactical region for smoke tests and contract validation.","region_id":"region:fixture-micro-region","schema_version":"1.0.0","source_fingerprint":"3ac603f0f8b826e5c60b494e2f88a2a5ddd6dc0c03b9b153fdac5424ac8d70f1","source_name":"fixture-micro-osm-roads","source_uri":"data/fixtures/region_builder/raw/fixture_micro_region_roads.geojson","spatial_ingest_id":"si:fixture-micro-region-roads:v1","transform_fingerprint":"bed4cc4c0a6bd94db605bf5163b76a761999731921ebdcdfe53d17466674f7cd"}],"travel_time_defaults":{"default_speed_kph":35.0,"intersection_penalty_seconds":4.0,"speed_kph_by_highway":{"residential":30.0,"secondary":45.0,"service":20.0,"tertiary":35.0}},"traversable_edge_count":12,"traversable_node_count":8}
